Model,Jenis Ringkasan,Output
"gp,a,AI kini sangat proaktif dalam pengembangan web, mampu mengubah desain menjadi kode secara otomatis; AI dapat mengoptimalkan performa dan struktur kode; AI juga bisa memberikan rekomendasi UI/UX; Dengan bantuan AI, developer dapat fokus pada ide, inovasi, dan pengalaman pengguna, bukan lagi pada detail teknis kecil."
gp,b,Percakapan ini membahas peran AI yang semakin proaktif dalam pengembangan web. AI tidak hanya mampu mengkonversi desain dari Figma atau Sketch menjadi kode secara otomatis, tetapi juga dapat mengoptimalkan performa, merapikan struktur kode, hingga memberikan rekomendasi UI/UX. Dengan bantuan AI, para developer bisa lebih fokus pada aspek-aspek yang lebih strategis, seperti ide, inovasi, dan pengalaman pengguna, alih-alih harus berurusan dengan detail teknis yang memakan waktu. Ini menunjukkan bahwa masa depan web development akan menjadi lebih cepat dan efisien dengan kolaborasi antara manusia dan AI.
"cgpt,a,AI di web dev: otomatis konversi desain ke kode; optimasi performa (loading, struktur kode); rekomendasi UI/UX; developer bisa fokus ide besar; masa depan web dev lebih cepat, rapi, fun."
cgpt,b,Percakapan membahas bagaimana AI kini semakin proaktif dalam workflow pengembangan web, mulai dari mengubah desain jadi kode otomatis, mengoptimalkan performa, hingga memberi rekomendasi UI/UX. Dengan bantuan AI, developer tidak perlu terjebak detail teknis kecil, sehingga bisa lebih fokus pada ide, inovasi, dan pengalaman pengguna. Masa depan pengembangan web pun digambarkan lebih cepat, rapi, serta menyenangkan.
"qw,a,AI semakin proaktif dalam workflow pengembangan web mulai dari konversi desain ke kode hingga optimasi performa; AI berperan seperti asisten atau mentor yang membantu efisiensi, rekomendasi UI/UX, dan struktur kode; Developer bisa fokus pada inovasi dan pengalaman pengguna, asal siap beradaptasi dan kolaborasi dengan AI;"
qw,b,Percakapan menggambarkan peran AI yang semakin integral dalam pengembangan web, mulai dari otomatisasi desain hingga optimasi teknis dan UX, memungkinkan developer fokus pada hal strategis — dengan catatan mereka siap berkolaborasi dan
"ds,a,AI mampu mengotomatisasi konversi desain ke kode; AI dapat mengoptimasi performa dan struktur kode; AI memberikan rekomendasi UI/UX untuk pengalaman pengguna yang lebih baik."
ds,b,Percakapan membahas peran proaktif AI dalam pengembangan web, mulai dari mengotomatisasi tugas konversi desain ke kode, mengoptimasi performa, hingga memberikan saran UI/UX. Hal ini memungkinkan developer untuk lebih fokus pada inovasi dan pengalaman pengguna, sehingga proses pengembangan menjadi lebih cepat, rapi, dan menyenangkan.
